{
  "geology_drops": {
    "default": {
      "wall": [
        { "item_id": "core_item_boulder_granite", "min": 3, "max": 3, "weight": 1.0 }
      ],
      "ramp": [
        { "item_id": "core_item_boulder_granite", "min": 1, "max": 1, "weight": 1.0 }
      ]
    },
    "core_geology_granite": {
      "wall": [
        { "item_id": "core_item_boulder_granite", "min": 3, "max": 3, "weight": 1.0 }
      ],
      "ramp": [
        { "item_id": "core_item_boulder_granite", "min": 1, "max": 1, "weight": 1.0 }
      ]
    },
    "core_geology_basalt": {
      "wall": [
        { "item_id": "core_item_boulder_basalt", "min": 3, "max": 3, "weight": 1.0 }
      ],
      "ramp": [
        { "item_id": "core_item_boulder_basalt", "min": 1, "max": 1, "weight": 1.0 }
      ]
    },
    "core_geology_iron_hematite": {
      "wall": [
        { "item_id": "core_item_ore_iron_hematite", "min": 2, "max": 4, "weight": 1.0 },
        { "item_id": "core_item_boulder_granite", "min": 1, "max": 2, "weight": 1.0 }
      ],
      "ramp": [
        { "item_id": "core_item_ore_iron_hematite", "min": 1, "max": 1, "weight": 1.0 }
      ]
    }
  },
  "geology_ticks": {
    "default": { "wall": 20, "ramp": 20 }
  },
  "tool_multipliers": {
    "none": 1.0
  },
  "ramp_result_terrain": "OpenWithFloor",
  "_comments": {
    "geology_drops": "Defines item drops per geology type. 'default' applies to all unspecified geologies. Each terrain type (wall/ramp) can have multiple drop entries with min/max quantity ranges.",
    "geology_ticks": "Base dig time in ticks per geology and terrain type. Wall is typically slower than ramp (or same).",
    "tool_multipliers": "Future: tool speed multipliers. 'none' = 1.0 (no tool, base speed). Lower values = faster.",
    "geology_mapping": "Future: map geology IDs to specific drop tables and tick overrides. E.g., iron ore veins drop hematite instead of generic boulder."
  }
}
